{
  "agency": "TREASURY",
  "version": "2.0.0",
  "measurementType": {
    "method": "modules"
  },
  "releases": [
    {
      "name": "data-act-broker-web-app",
      "description": "The DATA Act broker website is the front-end to the DATA Act broker backend.",
      "permissions": {
        "licenses": null,
        "usageType": "governmentWideReuse",
        "exemptionText": null
      },
      "tags": [
        "spending",
        "government",
        "transparency"
      ],
      "contact": {
        "email": "Renata.Maziarz@fiscal.treasury.gov"
      },
      "repositoryURL": "https://github.com/fedspendingtransparency/data-act-broker-web-app",
      "laborHours": 0
    },
    {
      "name": "data-act-broker-backend",
      "description": "The DATA Act broker backend is a collection of services that power the DATA Act's central data submission platform.",
      "permissions": {
        "licenses": null,
        "usageType": "openSource",
        "exemptionText": null
      },
      "tags": [
        "spending",
        "government",
        "transparency",
        "broker"
      ],
      "contact": {
        "email": "Renata.Maziarz@fiscal.treasury.gov"
      },
      "repositoryURL": "https://github.com/fedspendingtransparency/data-act-broker-backend",
      "laborHours": 0
    },
    {
      "name": "federal spending transparency",
      "description": "This collaboration space is designed to make federal spending data more accessible, searchable, reliable and meet the transparency requirements of the DATA Act.",
      "permissions": {
        "licenses": null,
        "usageType": "openSource",
        "exemptionText": null
      },
      "tags": [
        "spending",
        "government",
        "transparency",
        "Federal"
      ],
      "contact": {
        "email": "Renata.Maziarz@fiscal.treasury.gov"
      },
      "repositoryURL": "https://github.com/fedspendingtransparency/fedspendingtransparency.github.io",
      "laborHours": 0
    },
    {
      "name": "IDES-Data-Preparation-Java",
      "description": "The IDES Data Preparation Java project repository demonstrates a sample working application developed using Java.",
      "permissions": {
        "licenses": null,
        "usageType": "openSource",
        "exemptionText": null
      },
      "tags": [
        "IRS",
        "FATCA",
        "IDES"
      ],
      "contact": {
        "email": "lbi.fatca.ides@irs.gov"
      },
      "repositoryURL": "http://irsgov.github.io/IDES-Data-Preparation-Java",
      "laborHours": 0
    },
    {
      "name": "IDES-Data-Preparation-Dot-Net",
      "description": "The IDES Data Preparation .NET project repository demonstrates a sample working application developed using .NET",
      "permissions": {
        "licenses": null,
        "usageType": "openSource",
        "exemptionText": null
      },
      "tags": [
        "IRS",
        "FATCA",
        "IDES"
      ],
      "contact": {
        "email": "lbi.fatca.ides@irs.gov"
      },
      "repositoryURL": "http://irsgov.github.io/IDES-Data-Preparation-Dot-Net",
      "laborHours": 0
    }
  ]
}
