{
  "agency": "VA",
  "version": "2.0.0",
  "measurementType": {
    "method": "modules"
  },
  "releases": [
    {
      "name": "Caseflow Certification",
      "repositoryURL": "https://github.com/department-of-veterans-affairs/caseflow",
      "description": "Caseflow is a web application tracking and processing appealed claims at theVA Board of Veterans' Appeals.",
      "permissions": {
        "licenses": [
          {
            "URL": "https://github.com/department-of-veterans-affairs/caseflow/blob/master/LICENSE.md",
            "name": "CC0"
          }
        ],
        "usageType": "openSource",
        "exemptionText": null
      },
      "tags": [
        "VA",
        "Veteran",
        "Appeal",
        "Workflow",
        "Benefits"
      ],
      "contact": {
        "email": "ossoft@va.gov"
      },
      "organization": "OIT EPMO",
      "languages": [
        "Ruby"
      ],
      "laborHours": 0,
      "status": "Development",
      "vcs": "git"
    },
    {
      "name": "Vets.gov",
      "repositoryURL": "https://github.com/department-of-veterans-affairs/vets-website",
      "description": "Vets.gov is the consolidation of several critical Veteran-facing applications into a single web-based launchpad.",
      "permissions": {
        "licenses": [
          {
            "URL": "https://github.com/department-of-veterans-affairs/vets-website/blob/master/LICENSE",
            "name": "CC0"
          }
        ],
        "usageType": "openSource",
        "exemptionText": null
      },
      "tags": [
        "VA",
        "Veteran",
        "Benefits"
      ],
      "contact": {
        "email": "ossoft@va.gov"
      },
      "organization": "OIT EPMO",
      "languages": [
        "JavaScript"
      ],
      "laborHours": 0
    },
    {
      "name": "Vets.gov APIs",
      "repositoryURL": "https://github.com/department-of-veterans-affairs/vets-api",
      "description": "This project provides common APIs for applications that live on vets.gov.",
      "permissions": {
        "licenses": [
          {
            "URL": "https://github.com/department-of-veterans-affairs/vets-api/blob/master/LICENSE.md",
            "name": "CC0"
          }
        ],
        "usageType": "openSource",
        "exemptionText": null
      },
      "tags": [
        "VA",
        "Veteran",
        "Benefits",
        "api"
      ],
      "contact": {
        "email": "ossoft@va.gov"
      },
      "organization": "OIT EPMO",
      "languages": [
        "Ruby"
      ],
      "laborHours": 0
    },
    {
      "name": "Veterans Employment Center",
      "repositoryURL": "https://github.com/department-of-veterans-affairs/veterans-employment-center",
      "description": "Veterans Employment Center creates a website of links that assist a Veteran in a job search.",
      "permissions": {
        "licenses": null,
        "usageType": "openSource",
        "exemptionText": null
      },
      "tags": [
        "VA",
        "Veteran",
        "job"
      ],
      "contact": {
        "email": "ossoft@va.gov"
      },
      "organization": "OIT EPMO",
      "languages": [
        "Ruby"
      ],
      "laborHours": 0
    },
    {
      "name": "GIBCT Data Service",
      "repositoryURL": "https://github.com/department-of-veterans-affairs/gibct-data-service",
      "description": "GIDS compiles data from federal CSV-formatted sources into institution profiles to provide school metrics to the GI Bill Comparison Tool.",
      "permissions": {
        "licenses": [
          {
            "URL": "https://github.com/department-of-veterans-affairs/gibct-data-service/blob/master/LICENSE.md",
            "name": "CC0"
          }
        ],
        "usageType": "openSource",
        "exemptionText": null
      },
      "tags": [
        "GIBCT",
        "school",
        "Veteran",
        "Benefits"
      ],
      "contact": {
        "email": "ossoft@va.gov"
      },
      "organization": "OIT EPMO",
      "languages": [
        "Ruby"
      ],
      "laborHours": 0
    },
    {
      "name": "GI Bill Comparison Tool",
      "repositoryURL": "https://github.com/department-of-veterans-affairs/gi-bill-comparison-tool",
      "description": "The GI Bill Comparison Tool allows a Veteran to compare education benefits among potential schools.",
      "permissions": {
        "licenses": null,
        "usageType": "openSource",
        "exemptionText": null
      },
      "tags": [
        "GIBCT",
        "school",
        "Veteran",
        "Benefits"
      ],
      "contact": {
        "email": "ossoft@va.gov"
      },
      "organization": "OIT EPMO",
      "languages": [
        "Ruby"
      ],
      "laborHours": 0
    },
    {
      "name": "Choice Act Locator",
      "repositoryURL": "https://github.com/department-of-veterans-affairs/ChoiceActLocator",
      "description": "This web mapping application provides veterans the ability to search and find Non-VA Care providers through the Choice Act.",
      "permissions": {
        "licenses": null,
        "usageType": "openSource",
        "exemptionText": null
      },
      "tags": [
        "Choice Act",
        "Veteran",
        "Benefits"
      ],
      "contact": {
        "email": "ossoft@va.gov"
      },
      "organization": "OIT EPMO",
      "languages": [
        "JavaScript"
      ],
      "laborHours": 0
    }
  ]
}
